Título;Año publicación;Tema;Tags;Sinopsis;Ilustrador;Género ilustrador;Descripción ilustrador;Escritor;Género escritor;Descripción escritor;Editorial;Tipo de editorial;Descripción editorial;Ciudad;Editor;Género editor;Descripción editor
Chigüiro y el baño;2005;Hábitos;Baño, Chigüiro. Limpieza, Hábitos, Sin palabras, Juego, Primeros lectores, Espacios en blanco;Un cuento sin palabras sobre un chigüiro que está entretenido jugando solo con una pelota. De repente la pelota cae a un charco y le salpica de barro. Se entristece al verse sucio y decide bañarse y limpiar su pelota. El protagonista de la historia convierte así el acto de tomar un baño en una aventura divertida y el lector podrá sentirse identificado con Chigüiro y sus ocurrencias.\nTomado de https://ekidesign.com/de-2-a-5-anos/352-chiguiro-y-el-bano.html\nEste libro hace parte de la colección Chigüiro, la primera especializada en libros álbum. En esta colección no hay palabras pero el personaje principal ha sido construído para comunicar gracias a su movimiento y a su expresividad. Chigüiro marca el inicio de la creación de libro álbum en Colombia, su primer título fue publicado en 1986.;Ivar Da Coll;Hombre;Ivar da Coll es uno de los exponentes más importantes del libro álbum en Colombia. Su serie Chigüiro dio inicio a la producción de este formato en nuestro país. Este autor, nacido en Bogotá en 1962, es además un escritor prolífico que a lo largo de su carrera ha realizado más de 40 títulos. Ivar da Coll nació en Bogotá, Colombia, el 13 de marzo de 1962. Su padre era italiano y su madre de ascendencia sueca. Estudió en el colegio Juan Ramón Jiménez de Bogotá.\nEn 1999, fue nominado al Premio Hans Christian Andersen en la categoría de ilustración también hizo parte de la Lista de Honor de IBBY (International Board on Books for Young People).\nHa publicado también con las editoriales Carlos Valencia Editores (Colombia), Alfaguara (Colombia-México), Ediciones Anaya (España), Ediciones Ekaré (Venezuela), Houghton Mifflin Company, Mc Graw-Hill, Simon & Schuster y Lectorum (Estados Unidos). ;Ivar Da Coll;Hombre;Ivar da Coll es uno de los exponentes más importantes del libro álbum en Colombia. Su serie Chigüiro dio inicio a la producción de este formato en nuestro país. Este autor, nacido en Bogotá en 1962, es además un escritor prolífico que a lo largo de su carrera ha realizado más de 40 títulos. Ivar da Coll nació en Bogotá, Colombia, el 13 de marzo de 1962. Su padre era italiano y su madre de ascendencia sueca. Estudió en el colegio Juan Ramón Jiménez de Bogotá.\nEn 1999, fue nominado al Premio Hans Christian Andersen en la categoría de ilustración también hizo parte de la Lista de Honor de IBBY (International Board on Books for Young People).\nHa publicado también con las editoriales Carlos Valencia Editores (Colombia), Alfaguara (Colombia-México), Ediciones Anaya (España), Ediciones Ekaré (Venezuela), Houghton Mifflin Company, Mc Graw-Hill, Simon & Schuster y Lectorum (Estados Unidos). ;Babel libros;Independiente;Babel Libros empezó en 2001 en Bogotá como distribuidora y librería, con la arquitecta María Osorio encabezando el proyecto. En 2005 se amplió el proyecto con su propio sello editorial. Se han destacado por hacer libros con tiempo, dedicación y cuidado, tienen un amplio catálogo, no solo de libro álbum, también ofrecen libros para jóvenes. Babel recibió en la Feria del Libro de Boloña el premio BOP para la Mejor Editorial Infantil y Juvenil en América Latina (Centro y Sur América). \nPágina web: babellibros.com.co/;;;;
Chigüiro encuentra ayuda;2006;Amistad;Chigüiro, Amistad, Plátanos, Comida nacional, Juego, Sin palabras, Colaboración, Complicidad, Mico, Espacios en blanco;Chigüiro tiene hambre y encuentra que arriba, en la parte más alta del árbol, hay un delicioso racimo de plátanos. Lo malo es que está muy arriba y, por más que lo intenta, Chigüiro no los alcanza. Por suerte un amigo aparece para salvar el día. \nEste libro hace parte de la colección Chigüiro, la primera especializada en libros álbum. En esta colección no hay palabras pero el personaje principal ha sido construído para comunicar gracias a su movimiento y a su expresividad. Chigüiro marca el inicio de la creación de libro álbum en Colombia, su primer título fue publicado en 1986.;Ivar Da Coll;Hombre;Ivar da Coll es uno de los exponentes más importantes del libro álbum en Colombia. Su serie Chigüiro dio inicio a la producción de este formato en nuestro país. Este autor, nacido en Bogotá en 1962, es además un escritor prolífico que a lo largo de su carrera ha realizado más de 40 títulos. Ivar da Coll nació en Bogotá, Colombia, el 13 de marzo de 1962. Su padre era italiano y su madre de ascendencia sueca. Estudió en el colegio Juan Ramón Jiménez de Bogotá.\nEn 1999, fue nominado al Premio Hans Christian Andersen en la categoría de ilustración también hizo parte de la Lista de Honor de IBBY (International Board on Books for Young People).\nHa publicado también con las editoriales Carlos Valencia Editores (Colombia), Alfaguara (Colombia-México), Ediciones Anaya (España), Ediciones Ekaré (Venezuela), Houghton Mifflin Company, Mc Graw-Hill, Simon & Schuster y Lectorum (Estados Unidos). ;Ivar Da Coll;Hombre;Ivar da Coll es uno de los exponentes más importantes del libro álbum en Colombia. Su serie Chigüiro dio inicio a la producción de este formato en nuestro país. Este autor, nacido en Bogotá en 1962, es además un escritor prolífico que a lo largo de su carrera ha realizado más de 40 títulos. Ivar da Coll nació en Bogotá, Colombia, el 13 de marzo de 1962. Su padre era italiano y su madre de ascendencia sueca. Estudió en el colegio Juan Ramón Jiménez de Bogotá.\nEn 1999, fue nominado al Premio Hans Christian Andersen en la categoría de ilustración también hizo parte de la Lista de Honor de IBBY (International Board on Books for Young People).\nHa publicado también con las editoriales Carlos Valencia Editores (Colombia), Alfaguara (Colombia-México), Ediciones Anaya (España), Ediciones Ekaré (Venezuela), Houghton Mifflin Company, Mc Graw-Hill, Simon & Schuster y Lectorum (Estados Unidos). ;Babel libros;Independiente;Babel Libros empezó en 2001 en Bogotá como distribuidora y librería, con la arquitecta María Osorio encabezando el proyecto. En 2005 se amplió el proyecto con su propio sello editorial. Se han destacado por hacer libros con tiempo, dedicación y cuidado, tienen un amplio catálogo, no solo de libro álbum, también ofrecen libros para jóvenes. Babel recibió en la Feria del Libro de Boloña el premio BOP para la Mejor Editorial Infantil y Juvenil en América Latina (Centro y Sur América). \nPágina web: babellibros.com.co/;;;;
Chigüiro viaja en chiva;2006;;Chiguiro, Mico, Gallina, Chiva, Distracción, Colaboración, Cuidado, Peligro, Transporte, Colombia, Sin palabras, Espacios en blanco;¿Te imaginas un mono distraido que conduce una chiva que se dirige a la playa? Pues Chigüiro y Gallina hacen parte de los pasajeros de este vehículo, pero algo sucederá en el camino. \nTomado de https://maguare.gov.co/chiguiro-y-la-chiva/\nEste libro hace parte de la colección Chigüiro, la primera especializada en libros álbum. En esta colección no hay palabras pero el personaje principal ha sido construído para comunicar gracias a su movimiento y a su expresividad. Chigüiro marca el inicio de la creación de libro álbum en Colombia, su primer título fue publicado en 1986.;Ivar Da Coll;Hombre;Ivar da Coll es uno de los exponentes más importantes del libro álbum en Colombia. Su serie Chigüiro dio inicio a la producción de este formato en nuestro país. Este autor, nacido en Bogotá en 1962, es además un escritor prolífico que a lo largo de su carrera ha realizado más de 40 títulos. Ivar da Coll nació en Bogotá, Colombia, el 13 de marzo de 1962. Su padre era italiano y su madre de ascendencia sueca. Estudió en el colegio Juan Ramón Jiménez de Bogotá.\nEn 1999, fue nominado al Premio Hans Christian Andersen en la categoría de ilustración también hizo parte de la Lista de Honor de IBBY (International Board on Books for Young People).\nHa publicado también con las editoriales Carlos Valencia Editores (Colombia), Alfaguara (Colombia-México), Ediciones Anaya (España), Ediciones Ekaré (Venezuela), Houghton Mifflin Company, Mc Graw-Hill, Simon & Schuster y Lectorum (Estados Unidos). ;Ivar Da Coll;Hombre;Ivar da Coll es uno de los exponentes más importantes del libro álbum en Colombia. Su serie Chigüiro dio inicio a la producción de este formato en nuestro país. Este autor, nacido en Bogotá en 1962, es además un escritor prolífico que a lo largo de su carrera ha realizado más de 40 títulos. Ivar da Coll nació en Bogotá, Colombia, el 13 de marzo de 1962. Su padre era italiano y su madre de ascendencia sueca. Estudió en el colegio Juan Ramón Jiménez de Bogotá.\nEn 1999, fue nominado al Premio Hans Christian Andersen en la categoría de ilustración también hizo parte de la Lista de Honor de IBBY (International Board on Books for Young People).\nHa publicado también con las editoriales Carlos Valencia Editores (Colombia), Alfaguara (Colombia-México), Ediciones Anaya (España), Ediciones Ekaré (Venezuela), Houghton Mifflin Company, Mc Graw-Hill, Simon & Schuster y Lectorum (Estados Unidos). ;Babel libros;Independiente;Babel Libros empezó en 2001 en Bogotá como distribuidora y librería, con la arquitecta María Osorio encabezando el proyecto. En 2005 se amplió el proyecto con su propio sello editorial. Se han destacado por hacer libros con tiempo, dedicación y cuidado, tienen un amplio catálogo, no solo de libro álbum, también ofrecen libros para jóvenes. Babel recibió en la Feria del Libro de Boloña el premio BOP para la Mejor Editorial Infantil y Juvenil en América Latina (Centro y Sur América). \nPágina web: babellibros.com.co/;;;;
Chigüiro y el palo;2006;Problemas;Amistad, Compartir, Chigüiro, Mico, Pelea, Conflicto, Creatividad, Imaginación, Sin palabras, Juego, Espacios en blanco;Chigúiro está jugando con un palo y un piedra, y sin querer golpea a su amiigo que también quiere jugar pero de otra manera. ¿Cómo resolver este inminente problema?;Ivar Da Coll;Hombre;Ivar da Coll es uno de los exponentes más importantes del libro álbum en Colombia. Su serie Chigüiro dio inicio a la producción de este formato en nuestro país. Este autor, nacido en Bogotá en 1962, es además un escritor prolífico que a lo largo de su carrera ha realizado más de 40 títulos. Ivar da Coll nació en Bogotá, Colombia, el 13 de marzo de 1962. Su padre era italiano y su madre de ascendencia sueca. Estudió en el colegio Juan Ramón Jiménez de Bogotá.\nEn 1999, fue nominado al Premio Hans Christian Andersen en la categoría de ilustración también hizo parte de la Lista de Honor de IBBY (International Board on Books for Young People).\nHa publicado también con las editoriales Carlos Valencia Editores (Colombia), Alfaguara (Colombia-México), Ediciones Anaya (España), Ediciones Ekaré (Venezuela), Houghton Mifflin Company, Mc Graw-Hill, Simon & Schuster y Lectorum (Estados Unidos). ;Ivar Da Coll;Hombre;Ivar da Coll es uno de los exponentes más importantes del libro álbum en Colombia. Su serie Chigüiro dio inicio a la producción de este formato en nuestro país. Este autor, nacido en Bogotá en 1962, es además un escritor prolífico que a lo largo de su carrera ha realizado más de 40 títulos. Ivar da Coll nació en Bogotá, Colombia, el 13 de marzo de 1962. Su padre era italiano y su madre de ascendencia sueca. Estudió en el colegio Juan Ramón Jiménez de Bogotá.\nEn 1999, fue nominado al Premio Hans Christian Andersen en la categoría de ilustración también hizo parte de la Lista de Honor de IBBY (International Board on Books for Young People).\nHa publicado también con las editoriales Carlos Valencia Editores (Colombia), Alfaguara (Colombia-México), Ediciones Anaya (España), Ediciones Ekaré (Venezuela), Houghton Mifflin Company, Mc Graw-Hill, Simon & Schuster y Lectorum (Estados Unidos). ;Babel libros;Independiente;Babel Libros empezó en 2001 en Bogotá como distribuidora y librería, con la arquitecta María Osorio encabezando el proyecto. En 2005 se amplió el proyecto con su propio sello editorial. Se han destacado por hacer libros con tiempo, dedicación y cuidado, tienen un amplio catálogo, no solo de libro álbum, también ofrecen libros para jóvenes. Babel recibió en la Feria del Libro de Boloña el premio BOP para la Mejor Editorial Infantil y Juvenil en América Latina (Centro y Sur América). \nPágina web: babellibros.com.co/;;;;
Nano y los muñecos;2008;Creatividad;Amistad, Madre, Hijo, Niño, Juego, Sin palabras, Creatividad, Recursividad, Colección Buenas Noches;Nano está con su madre y se le rompe una media. Pero ella sabe qué hacer, solo necesita hilo y algunas otras cosas para convertir el calcetín roto en una serpiente. Esto se convierte en una gran fuente de diversión para Nano y sus amigos, que ahora puedan convertir cualquier objeto en un ser divertido para jugar.;Ivar Da Coll;Hombre;Ivar da Coll es uno de los exponentes más importantes del libro álbum en Colombia. Su serie Chigüiro dio inicio a la producción de este formato en nuestro país. Este autor, nacido en Bogotá en 1962, es además un escritor prolífico que a lo largo de su carrera ha realizado más de 40 títulos. Ivar da Coll nació en Bogotá, Colombia, el 13 de marzo de 1962. Su padre era italiano y su madre de ascendencia sueca. Estudió en el colegio Juan Ramón Jiménez de Bogotá.\nEn 1999, fue nominado al Premio Hans Christian Andersen en la categoría de ilustración también hizo parte de la Lista de Honor de IBBY (International Board on Books for Young People).\nHa publicado también con las editoriales Carlos Valencia Editores (Colombia), Alfaguara (Colombia-México), Ediciones Anaya (España), Ediciones Ekaré (Venezuela), Houghton Mifflin Company, Mc Graw-Hill, Simon & Schuster y Lectorum (Estados Unidos). ;Ivar Da Coll;Hombre;Ivar da Coll es uno de los exponentes más importantes del libro álbum en Colombia. Su serie Chigüiro dio inicio a la producción de este formato en nuestro país. Este autor, nacido en Bogotá en 1962, es además un escritor prolífico que a lo largo de su carrera ha realizado más de 40 títulos. Ivar da Coll nació en Bogotá, Colombia, el 13 de marzo de 1962. Su padre era italiano y su madre de ascendencia sueca. Estudió en el colegio Juan Ramón Jiménez de Bogotá.\nEn 1999, fue nominado al Premio Hans Christian Andersen en la categoría de ilustración también hizo parte de la Lista de Honor de IBBY (International Board on Books for Young People).\nHa publicado también con las editoriales Carlos Valencia Editores (Colombia), Alfaguara (Colombia-México), Ediciones Anaya (España), Ediciones Ekaré (Venezuela), Houghton Mifflin Company, Mc Graw-Hill, Simon & Schuster y Lectorum (Estados Unidos). ;Grupo Editorial Norma;Grande;;;;;
Chigüiro, Abo y Ata;2010;Crecer;Abuelos, Chigüiro, Crecer, Afán, Infancia, Pequeño, Grande, Familia;Chigüiro quiere hacer todas las cosas que Abo y Ata hacen pero para ello debe esperar que pase el tiempo y ser grande. Mientras espera, Chigüiro ve que hay cosas que solo puede hacer siendo pequeño.;Ivar Da Coll;Hombre;Ivar da Coll es uno de los exponentes más importantes del libro álbum en Colombia. Su serie Chigüiro dio inicio a la producción de este formato en nuestro país. Este autor, nacido en Bogotá en 1962, es además un escritor prolífico que a lo largo de su carrera ha realizado más de 40 títulos. Ivar da Coll nació en Bogotá, Colombia, el 13 de marzo de 1962. Su padre era italiano y su madre de ascendencia sueca. Estudió en el colegio Juan Ramón Jiménez de Bogotá.\nEn 1999, fue nominado al Premio Hans Christian Andersen en la categoría de ilustración también hizo parte de la Lista de Honor de IBBY (International Board on Books for Young People).\nHa publicado también con las editoriales Carlos Valencia Editores (Colombia), Alfaguara (Colombia-México), Ediciones Anaya (España), Ediciones Ekaré (Venezuela), Houghton Mifflin Company, Mc Graw-Hill, Simon & Schuster y Lectorum (Estados Unidos). ;Ivar Da Coll;Hombre;Ivar da Coll es uno de los exponentes más importantes del libro álbum en Colombia. Su serie Chigüiro dio inicio a la producción de este formato en nuestro país. Este autor, nacido en Bogotá en 1962, es además un escritor prolífico que a lo largo de su carrera ha realizado más de 40 títulos. Ivar da Coll nació en Bogotá, Colombia, el 13 de marzo de 1962. Su padre era italiano y su madre de ascendencia sueca. Estudió en el colegio Juan Ramón Jiménez de Bogotá.\nEn 1999, fue nominado al Premio Hans Christian Andersen en la categoría de ilustración también hizo parte de la Lista de Honor de IBBY (International Board on Books for Young People).\nHa publicado también con las editoriales Carlos Valencia Editores (Colombia), Alfaguara (Colombia-México), Ediciones Anaya (España), Ediciones Ekaré (Venezuela), Houghton Mifflin Company, Mc Graw-Hill, Simon & Schuster y Lectorum (Estados Unidos). ;Babel libros;Independiente;Babel Libros empezó en 2001 en Bogotá como distribuidora y librería, con la arquitecta María Osorio encabezando el proyecto. En 2005 se amplió el proyecto con su propio sello editorial. Se han destacado por hacer libros con tiempo, dedicación y cuidado, tienen un amplio catálogo, no solo de libro álbum, también ofrecen libros para jóvenes. Babel recibió en la Feria del Libro de Boloña el premio BOP para la Mejor Editorial Infantil y Juvenil en América Latina (Centro y Sur América). \nPágina web: babellibros.com.co/;;;;
Chigüiro Rana Ratón;2010;;Representación, Animales, Chigüiro, Vaca, Rana, Ratón, Oso, Cambio de roles, Texto, Aburrimiento;Chigüiro sale a caminar y se encuentra a Vaca, él quiere jugar pero tal vez ni ella ni Oso quieren jugar a lo mismo. Chigüiro se va entonces a buscar otros compañeros de aventuras, ¿qué podrá hacer con Ratón y con Rana?;Ivar Da Coll;Hombre;Ivar da Coll es uno de los exponentes más importantes del libro álbum en Colombia. Su serie Chigüiro dio inicio a la producción de este formato en nuestro país. Este autor, nacido en Bogotá en 1962, es además un escritor prolífico que a lo largo de su carrera ha realizado más de 40 títulos. Ivar da Coll nació en Bogotá, Colombia, el 13 de marzo de 1962. Su padre era italiano y su madre de ascendencia sueca. Estudió en el colegio Juan Ramón Jiménez de Bogotá.\nEn 1999, fue nominado al Premio Hans Christian Andersen en la categoría de ilustración también hizo parte de la Lista de Honor de IBBY (International Board on Books for Young People).\nHa publicado también con las editoriales Carlos Valencia Editores (Colombia), Alfaguara (Colombia-México), Ediciones Anaya (España), Ediciones Ekaré (Venezuela), Houghton Mifflin Company, Mc Graw-Hill, Simon & Schuster y Lectorum (Estados Unidos). ;Ivar Da Coll;Hombre;Ivar da Coll es uno de los exponentes más importantes del libro álbum en Colombia. Su serie Chigüiro dio inicio a la producción de este formato en nuestro país. Este autor, nacido en Bogotá en 1962, es además un escritor prolífico que a lo largo de su carrera ha realizado más de 40 títulos. Ivar da Coll nació en Bogotá, Colombia, el 13 de marzo de 1962. Su padre era italiano y su madre de ascendencia sueca. Estudió en el colegio Juan Ramón Jiménez de Bogotá.\nEn 1999, fue nominado al Premio Hans Christian Andersen en la categoría de ilustración también hizo parte de la Lista de Honor de IBBY (International Board on Books for Young People).\nHa publicado también con las editoriales Carlos Valencia Editores (Colombia), Alfaguara (Colombia-México), Ediciones Anaya (España), Ediciones Ekaré (Venezuela), Houghton Mifflin Company, Mc Graw-Hill, Simon & Schuster y Lectorum (Estados Unidos). ;Babel libros;Independiente;Babel Libros empezó en 2001 en Bogotá como distribuidora y librería, con la arquitecta María Osorio encabezando el proyecto. En 2005 se amplió el proyecto con su propio sello editorial. Se han destacado por hacer libros con tiempo, dedicación y cuidado, tienen un amplio catálogo, no solo de libro álbum, también ofrecen libros para jóvenes. Babel recibió en la Feria del Libro de Boloña el premio BOP para la Mejor Editorial Infantil y Juvenil en América Latina (Centro y Sur América). \nPágina web: babellibros.com.co/;;;;
Chigüiro se va;2010;Familia;Conflicto, Chigüiro, Vínculos afectivos, Viaje, Búsqueda, Oso, Tortuga, Vaca, Pelea, Reconciliación;Chigüiro y Ata pelean, entonces Chigüiro decide ir a explorar otros lugares donde no tenga que pelear con nadie. Va a casa de Tortuga, Vaca y Oso pero siempre hay algo que no le termina de convencer. ;Ivar Da Coll;Hombre;Ivar da Coll es uno de los exponentes más importantes del libro álbum en Colombia. Su serie Chigüiro dio inicio a la producción de este formato en nuestro país. Este autor, nacido en Bogotá en 1962, es además un escritor prolífico que a lo largo de su carrera ha realizado más de 40 títulos. Ivar da Coll nació en Bogotá, Colombia, el 13 de marzo de 1962. Su padre era italiano y su madre de ascendencia sueca. Estudió en el colegio Juan Ramón Jiménez de Bogotá.\nEn 1999, fue nominado al Premio Hans Christian Andersen en la categoría de ilustración también hizo parte de la Lista de Honor de IBBY (International Board on Books for Young People).\nHa publicado también con las editoriales Carlos Valencia Editores (Colombia), Alfaguara (Colombia-México), Ediciones Anaya (España), Ediciones Ekaré (Venezuela), Houghton Mifflin Company, Mc Graw-Hill, Simon & Schuster y Lectorum (Estados Unidos). ;Ivar Da Coll;Hombre;Ivar da Coll es uno de los exponentes más importantes del libro álbum en Colombia. Su serie Chigüiro dio inicio a la producción de este formato en nuestro país. Este autor, nacido en Bogotá en 1962, es además un escritor prolífico que a lo largo de su carrera ha realizado más de 40 títulos. Ivar da Coll nació en Bogotá, Colombia, el 13 de marzo de 1962. Su padre era italiano y su madre de ascendencia sueca. Estudió en el colegio Juan Ramón Jiménez de Bogotá.\nEn 1999, fue nominado al Premio Hans Christian Andersen en la categoría de ilustración también hizo parte de la Lista de Honor de IBBY (International Board on Books for Young People).\nHa publicado también con las editoriales Carlos Valencia Editores (Colombia), Alfaguara (Colombia-México), Ediciones Anaya (España), Ediciones Ekaré (Venezuela), Houghton Mifflin Company, Mc Graw-Hill, Simon & Schuster y Lectorum (Estados Unidos). ;Babel libros;Independiente;Babel Libros empezó en 2001 en Bogotá como distribuidora y librería, con la arquitecta María Osorio encabezando el proyecto. En 2005 se amplió el proyecto con su propio sello editorial. Se han destacado por hacer libros con tiempo, dedicación y cuidado, tienen un amplio catálogo, no solo de libro álbum, también ofrecen libros para jóvenes. Babel recibió en la Feria del Libro de Boloña el premio BOP para la Mejor Editorial Infantil y Juvenil en América Latina (Centro y Sur América). \nPágina web: babellibros.com.co/;Bogotá;;;
