Título;Año publicación;Tema;Tags;Sinopsis;Ilustrador;Género ilustrador;Descripción ilustrador;Escritor;Género escritor;Descripción escritor;Editorial;Tipo de editorial;Descripción editorial;Ciudad;Editor;Género editor;Descripción editor
Mi alfabeto;2012;Alfabeto;Animales, Extinción, Letras, Lenguaje, Palabras, Primeros lectores;De la A a la zeta los niños conocerán el alfabeto y los nombres de los animales en peligro de extinción que acompañan cada letra. Una manera divertida de acercar a los más pequeños a lenguaje escrito, con ilustraciones expresivas y coloridas que celebran el amor por los animales.\nTomado de: https://www.loqueleo.com/co/libro/mi-alfabeto;Olga Cuéllar Serrano;Mujer;;Olga Cuéllar Serrano;Mujer;;Alfaguara infanil y juvenil;Grande;;;;;
Escondidas;2005;Juego;Niña, Juego, Sin palabras, Juguetes, Nidos para la lectura;Hay muchos lugares para esconderse y jugar. En este libro sin palabras la pequeña protagonista juega a esconderse con sus amigos juguetes.;Olga Cuéllar Serrano;Mujer;;Olga Cuéllar Serrano;Mujer;;Alfaguara infanil y juvenil;Grande;;;;;
El viaje de los elefantes;2011;Viajes;Elefantes, Libertad, Aventura, Viajes, Cambios;Un libro fresco y ameno como sus trazos, es un libro sobre la vida y la libertad. nos demuestra dulcemente que los grandes esfuerzos no dependen del tamaño, porque no todo en la vida es como parece. El viaje de los elefantes es una aventura que fluye de aquí para allá y de allá para acá, mostrándonos la grandeza de cinco elefantes que emprenden una aventura a lo largo y ancho del mundo y de la vida misma. \n White Raven 2011 , Libro Altamente Recomendado, 2012, Fundalectura\nTomado de: http://www.editorialgatomalo.com/v2/El_viaje_de_los_elefantes.html \nEl viaje de los elegantes fue un libro concebido a partir de un juego con diversas composiciones gráficas, primero un juego de formas geométricas de donde salen los personajes y luego un juego de las posibilidades en composición, manejo de planos, encuadres, y en general aprovechando los sentidos que genera una u otra composición.\nTomado de: http://dipacho.blogspot.com/2011/05/el-viaje-de-los-elefantes.html;Dipacho;Hombre;;Dipacho;Hombre;;Gatomalo;Independiente;;;;;
Días de Mateo;2016;Amistad;Amistad, Mascota, Perro, Niña, Azul, Blanco, Vínculos, Diversión;Para que el vínculo con tu perro sea indeleble, sólo necesitas pintar de negro, blanco y azul los días que compartan juntos y expresar a través de sencillas palabras cómo tu vida sin tu amigo canino no será nunca la misma. \nCarla Prato, a través de ilustraciones que hablan por sí solas y de palabras que se viven como la vida misma, nos presenta “Días de Mateo”, un libro que hará eterna la amistad entre un perro y un humano.\nTomado de: https://www.albaricoquelibros.com/ideas-en-su-tinta;Carla Prato;Mujer;;Carla Prato;Mujer;;Albaricoque;Independiente;“Albaricoque Libros es una editorial independiente, en crecimiento, que busca la producción de libros ilustrados de alta calidad literaria y estética que motiven, a cualquier edad, la interpretación significativa de imágenes y texto. Su nombre surge de la experiencia misma de la lectura de libros de este tipo, que siempre resultará dulce, única y trascendente.” Fragmento de: Asociación Colombiana de Literatura Infantil y Juvenil – ACLIJ. “LIJ COLOMBIA 2015-2018. Libros infantiles y juveniles editados en Colombia”. iBooks. ;;;;
Un gato de verdad;2015;Identidad;Gato, Diferencia, Identidad, Comparación, Reglas, Juego ;¿Qué se necesita para ser un gato de verdad? ¿Maullar toda la noche? ¿Cazar ratoncillos? ¡O tal vez solo se necesite un poquito de imaginación! En este libro-álbum te encontrarás con la cotidianidad de un gato poco común que parece divertirse de manera insólita. ¿Tú has sido gato alguna vez? ¿Has odiado bañarte por las mañanas? Al final creemos que todos somos, en el fondo, un poco gatunos.\n Tomado de: http://www.luabooks.com/un-gato-de-verdad/;Eulalia Cornejo;Mujer;;Lizardo Carvajal;Hombre;;LuaBooks;Independiente;;;;;
El abrigo;2013;Memoria;Olvido, distracción, Niña, Pérdida, Amistad;Julia suele olvidar sus cosas en casa y por eso, al salir, siempre se encuentra con algunas dificultades. Julia vive en la luna. Todos los días olvida algo nuevo: sus gafas, su sombrilla y ¡hasta sus botas para la lluvia! En su viaje por la memoria, ella tiene un compañero inseparable que le dará la clave para conjurar sus olvidos. Este es un libro para leer, jugar y disfrutar con los más pequeños. Contiene un afiche para colorear y compartir los mejores recuerdos.\nTomado de: http://www.reynaranjo.net/libros/abrigo.html;Andrea Sánchez Zuluaga;Mujer;Andrea Sánchez Zuluaga Colombia, 1990\nEs maestra en Artes Visuales de la Universidad Javeriana. El abrigo, su primer libro, fue seleccionado dentro del Programa de Estímulos del Instituto Distrital de las Artes, IDARTES. Ha ganado varios reconocimientos a nivel nacional, entre los que se destaca la Beca para proyectos editoriales en Artes plásticas y visuales (2014) de IDARTES y la Beca de creación para artistas emergentes (2015) del Ministerio de Cultura. Le encanta viajar, la playa y su compañera inseparable es una bicicleta verde heredada de su padre.\nTomado de: http://www.reynaranjo.net/libros/abrigo.html;Andrea Sánchez Zuluaga;Mujer;;Rey Naranjo;Independiente;;Bogotá;;;
Los dinosaurios;2016;Cambios;Dinosaurios, Cambios, Padre, Historias, Ausencia, Aguadas;Un papá le cuenta historias de dinosaurios a su hijo, con ellas juegan y crean un mundo nuevo. Sin embargo, la vida sigue y mientras el hijo crece, el papá envejece. Un día papá ya no está y es el hijo quien luego cuenta las historias de dinosaurios. Es una historia sobre la vida, sobre las generaciones y sobre la imaginación.\n Tomado de: https://www.librosmrfox.com/product-page/los-dinosaurios-ana-mar%C3%ADa-d%C3%ADaz-manuela-fandi%C3%B1o;Manuela Fandiño;Mujer;Manuela Fandiño nació en Bogotá, tiene 21 años y es estudiante de artes plásticas de la Universidad Nacional de Colombia. Desde temprana edad le ha gustado el dibujo y la ilustración. También, siente una gran pasión por el grabado y la pintura, lo cual le ha llevado a crear un diálogo entre el lenguaje de la gráfica con el del arte dentro de su trabajo. En sus ilustraciones hay un interés por los detalles y la minucia.\nTomado de: http://elsalmoneditores.com/ilustradores;Ana María Díaz;Mujer;Es co-fundadora de El salmón editores y directora de proyectos de la editorial. Es egresada del programa de literatura de la Universidad de los Andes y escribe cuentos para niños, dos de ellos, La playa y Los dinosaurios, ya se han publicado con El salmón editores. En el 2011 fue seleccionada para participar en los talleres de crónica del Banco de la República en asociación con la Pontificia Universidad Javeriana y su crónica apareció en la publicación Memorias del agua en Bogotá.\nTomado de: http://elsalmoneditores.com/ilustradores;El Salmón Editores;Independiente;Somos una editorial independiente en Bogotá, Colombia y hacemos libros ilustrados. Tenemos como propósito promover la lectura, para esto hacemos libros que cualquiera pueda leer, que lleguen a cada esquina y en los que cada palabra esté medida.\nTomado de:  http://elsalmoneditores.com/quienes-somos;Medellín;;;
Manual para cazar una idea;2015;Conflictos;Resolución, Ideas, Creatividad, Problemas, Búsqueda, Aventura;Un caza ideas transita por los terrenos de la imaginación en busca de una idea para dibujar. ¡Si al menos supiera dónde conseguir una! ¿Te imaginas cómo logrará atraparla?\nUn libro ilustrado para el desarrollo de la creatividad y la resolución de problemas.\nTomado de:  https://www.tragaluzeditores.com/libros/manual-para-cazar-una-idea/;Catalina Vázquez;Mujer;;José Andrés Gómez;Hombre;;Tragaluz;Independiente;;Medellín;;;
El perro de arena;2014;Tiempo;Fotografía, Correspondencia, Perro, Tiempo, Cambios, Despedida;En la correspondencia que le envía Clara a su prima queda registrado el hallazgo de un perro de arena. Por fortuna, en su cumpleaños, recibe de regalo una cámara fotográfica que le permite documentar los comportamientos de este ser extraño, cuya presencia la obliga a volver a la playa todos los días. Así que, además de los mensajes, Clara suma a sus descripciones las fotos del animal que amenaza con desaparecer entre las olas y las dunas y con cambiar para siempre la imagen que esta tiene del mar.\nLa idea original del relato es de la ilustradora Alejandra Estrada, quien convocó a la escritora Claudia Aguirre para darle forma a las cartas que atestiguan el paso fugaz del perro de arena. Alejandra también es la creadora de los dibujos del cuento.\nEsta obra fue ganadora de la X Convocatoria de Becas a la Creación Artística y Cultural, Medellín – 2013, en el área de literatura infantil, modalidad: creación en literatura infantil, libro ilustrado.\nTomado de: https://www.tragaluzeditores.com/libros/el-perro-de-arena/;Claudia Estrada;Mujer;;Claudia Aguirre;Mujer;;Tragaluz;Independiente;;Medellín;;;
Costuras;2013;Imaginación;Enfermedad, Recuperación, Cuidado, Curiosidad, Imaginación, Niña, Apendicitis;“Ana no podía ir al colegio porque le habían sacado el apéndice…”\nEste libro álbum es el producto de un diálogo entre un escritor y una dibujante que se encuentran para contar la historia de una niña que no puede ir al colegio porque le han sacado el apéndice. Esta situación sirve para explorar, a través del símbolo de la cicatriz de su cirugía, las relaciones entre el dolor y la memoria.\nDiseñado por Joni b\nCoedición con la Editorial Robot\nProyecto Ganador de la Beca para la Publicación de libro ilustrado, álbum, cómic, novela gráfica, dirigido a jóvenes entre 7 y 16 años.\nTomado de: http://lagunalibros.com/2013/costuras/;Power Paola;Mujer;1960-1990, dibujante\nPowerpaola, conocida en varios países por sus trabajos con contenido gráfico cercanos al cómic, entre los que se destaca Virus Tropical, editado en tres tomos por La silueta, en donde cuenta el trayecto que va desde su concepción en Ecuador hasta su adolescencia en Colombia.\nhttp://lagunalibros.com/2013/power-paola/;Alejandro Martín;Hombre;;Laguna Libros;Independiente;;Bogotá;;;
El niño gato;2013;Identidad;Juego, Gato, Soledad, Imaginación, Fortaleza;Sin amigos, sin padres y encerrado en su interior, el personaje principal de este libro álbum descubre su lugar en el mundo mientras lucha contra sus bigotes y se esconde tras una caja de lápices.;Dipacho;Hombre;;Triunfo Arciniegas;Hombre;;SM;Grande;;;;;
Bola de agua;2009;Tristeza;Tristeza, Agua, Mujer, Adultos, Emociones, Mente;Texto e imagen danzan a través de un acordeón de sensaciones. Tal vez literatura infantil, tal vez literatura para ese niño que en todos habita, eso lo dirá el lector. Un libro tan esmerado en sus textos, en sus ilustraciones, como en su diseño. un deleite para los sentidos.\nEste libro recibió uno de los galardones más importantes de América Latina: Ganador en Los mejores libros para niños y jóvenes 2012, libros originales, Banco del libro de Venezuela, una sección de IBBY.\nMas información: https://www.elmundo.com/portal/resultados/detalles/?idx=197273\nTomado de: https://www.tragaluzeditores.com/libros/bola-de-agua/;José Antonio Suárez Londoño;Hombre;;Pilar Gutiérrez Llano;Mujer;;Tragaluz;Independiente;Somos una editorial independiente colombiana. Desde 2005 publicamos libros que atraen por sus diseños y su contenido, libros en los que cada detalle importa. Hacemos libros que remiten a los primeros textos infantiles, entrañables, donde la lectura es una experiencia de todos los sentidos. Que nuestros libros sean para tocar, para sentir, que sean ilustrados, es nuestra forma de decir a los lectores: volvamos a esa primera lectura, donde todo sorprende, donde todo es descubrimiento.\nTomado de: https://www.tragaluzeditores.com/la-editorial/;Medellín;;;
Mi mascota;2011;Imaginación;Niño, Mascota, Elefante, Padre, Familia, Imaginación, Juego;¿Cual es la mejor mascota para un niño?, ¿qué mascota es capaz de hacer todo lo que él quiere en el momento en que se lo pide? Los graciosos versos de Yolanda Reyes, acompañados por las acuarelas de Rafael Yockteng develarán el misterio...\nTomado de: https://www.librosmrfox.com/product-page/mi-mascota-yolanda-reyes-y-rafael-yockteng;Rafael Yockteng;Hombre;Rafael Yockteng nació en 1976 en Lima, Perú. Estudió Diseño Gráfico en la Universidad Jorge Tadeo Lozano en Bogotá, Colombia, dónde supo que se dedicaría por completo al diseño. desde entonces, ha ilustrado varios libros para niños. En el año 2000 ganó la convocatoria Utopía (IBBY), dirigida a ilustradores latinoamericanos de textos infantiles. Algunos de sus libros han sido merecedores de importantes reconocimientos, como la Lista de Honor de IBBY, Lista White Ravens y los mejores libros del banco del libro de Venezuela.\nReseña tomada de Ekaré.;Yolanda Reyes;Mujer;;Babel libros;Independiente;;;;;
Historias de Eusebio;1989;;Carlos Valencia editores, Amistad, Animales, Juego, Animales, Vínculos;En estas historias, que funcionan como los cuentos clásicos por la acumulación y la reiteración, conoceremos a Eusebio y sus amigos, un grupo de pequeños animales que movidos por la solidaridad y el afecto, viven situaciones significativas de la infancia.\nUna reedición de los 3 cuentos originales en un nuevo libro.;Ivar Da Coll;Hombre;;Ivar Da Coll;Hombre;;Babel libros;Independiente;;;;;
El señor L. Fante;2006;Soledad;Ausencia, Familia, Soledad, Memoria, Tristeza, Elefante, Blanco y negro;Un libro que narra la soledad en la que vive el señor L. Fante, que se parece a todos nosotros en algún momento. a todos los que vivimos en grandes ciudades, donde, muchas veces, las compañías surgen de los escondrijos más inusitados, de los recuerdos más indómitos de la memoria. Un libro sobre la memoria, el olvido, sobre la inagotable capacidad del ser humano de recordar.\nTomado de: https://makemake.com.co/libros/MM0055/el-senor-l-fante/;Jairo Buitrago;Hombre;Escritor de libros álbum para niños, ilustrador e investigador de temas cinematográficos. Ha publicado los siguientes libros ilustrados : El señor L.Fante (2006), Emiliano (2007), Camino a Casa (2008), Eloísa y los bichos (2009), El Primer día (2010), Jimmy el más grande (2010), Cuentos desobedientes (2012), ¿Qué puedo decirte de los fantasmas? (2013), El mar (2014) y El Niño en el hotel al borde de la carretera ( 2014) y las novelas Las pesquisas comenzaron en Baker Street (2010) y Días de rock de garaje (2012). En el 2007 fue el ganador del 11 concurso de álbum Ilustrado A la Orilla del Viento del Fondo de Cultura Económica de México con Camino a Casa que igualmente fue seleccionado por la Lista de Honor del IBBY. 2010 Ha sido guionista de programas infantiles y trabaja en talleres de literatura y cine para niños y adultos.\nTomado de http://jairo-buitrago.blogspot.com/;Jairo Buitrago;Hombre;Escritor de libros álbum para niños, ilustrador e investigador de temas cinematográficos. Ha publicado los siguientes libros ilustrados : El señor L.Fante (2006), Emiliano (2007), Camino a Casa (2008), Eloísa y los bichos (2009), El Primer día (2010), Jimmy el más grande (2010), Cuentos desobedientes (2012), ¿Qué puedo decirte de los fantasmas? (2013), El mar (2014) y El Niño en el hotel al borde de la carretera ( 2014) y las novelas Las pesquisas comenzaron en Baker Street (2010) y Días de rock de garaje (2012). En el 2007 fue el ganador del 11 concurso de álbum Ilustrado A la Orilla del Viento del Fondo de Cultura Económica de México con Camino a Casa que igualmente fue seleccionado por la Lista de Honor del IBBY. 2010 Ha sido guionista de programas infantiles y trabaja en talleres de literatura y cine para niños y adultos.\nTomado de http://jairo-buitrago.blogspot.com/;Babel libros;Independiente;;;;;
Formas;2009;Identidad;Aprendizaje temprano, Tamaños, Formas, Figuras, Pareja, Vínculos, Sin palabras, Humor;Un cuento con formas y que relata los encuentros y desencuentros de una pareja destinada a mucho más de lo que originalmente se imagina el lector.\nTomado de: http://www.oceanotravesia.mx/obras/formas-claudia-rueda-8038.aspx;Claudia Rueda;Mujer;Claudia Rueda estudió artes plásticas, tomó un curso de ilustración de libros para niños en la Universidad de Berkeley y ha sido caricaturista, abogada, autora de cartillas educativas, viajera y madre de dos hijas. Ha trabajado como autora e ilustradora de libros para niños en España, México y Estados Unidos. Sus libros: Tres ciegos y un elefante, España: Imaginarium, 2002. Going to Grandma’s Farm, Scholastic/Children’s Press, 2002. La Suerte de Ozu, México: Fondo de Cultura Económica, 2003. There Was an Old Lady Who Swallowed a Fly, Intervisual Books, 2004. Eency Weency Spider, Intervisual Books, 2005. Nacho & Lolita, de Pam Muñoz Ryan, Scholastic Press, 2005. Mientras se Enfría el Pastel, Serres, 2005. Let’s Play in the Forest / Juguemos en el Bosque, Scholastic Press, 2006 y Vaya Apetito tiene el Zorrito, Serres (próximo a salir). \nTomado de La aventura de ilustrar en Colombia, en http://noticias.editorialgatomalo.com/NHL14_ilustrador.pdf;Claudia Rueda;Mujer;Claudia Rueda estudió artes plásticas, tomó un curso de ilustración de libros para niños en la Universidad de Berkeley y ha sido caricaturista, abogada, autora de cartillas educativas, viajera y madre de dos hijas. Ha trabajado como autora e ilustradora de libros para niños en España, México y Estados Unidos. Sus libros: Tres ciegos y un elefante, España: Imaginarium, 2002. Going to Grandma’s Farm, Scholastic/Children’s Press, 2002. La Suerte de Ozu, México: Fondo de Cultura Económica, 2003. There Was an Old Lady Who Swallowed a Fly, Intervisual Books, 2004. Eency Weency Spider, Intervisual Books, 2005. Nacho & Lolita, de Pam Muñoz Ryan, Scholastic Press, 2005. Mientras se Enfría el Pastel, Serres, 2005. Let’s Play in the Forest / Juguemos en el Bosque, Scholastic Press, 2006 y Vaya Apetito tiene el Zorrito, Serres (próximo a salir). Tomado de La aventura de ilustrar en Colombia, en http://noticias.editorialgatomalo.com/NHL14_ilustrador.pdf;Océano Travesía;;;;;;
Todo es relativo;2011;Percepción;Rimas, Adivinzanzas, Juegos de lenguaje, Percepción, Diferencia;Un pequeño ratón intenta escapar de un aterrador gato negro. Ambos inician una larga persecución en la que se encuentran con todo tipo de situaciones, lugares y animales. Esto los lleva a descubrir que todo es relativo. Porque la percepción de las cosas puede variar de uno a otro. ¿Será este el final del pobre ratón, o será tan sólo el principio de otra historia?\nTomado de: http://www.oceanotravesia.mx/ficha-libro.aspx?id=11055;Claudia Rueda;Mujer;Claudia Rueda estudió artes plásticas, tomó un curso de ilustración de libros para niños en la Universidad de Berkeley y ha sido caricaturista, abogada, autora de cartillas educativas, viajera y madre de dos hijas. Ha trabajado como autora e ilustradora de libros para niños en España, México y Estados Unidos. Sus libros: Tres ciegos y un elefante, España: Imaginarium, 2002. Going to Grandma’s Farm, Scholastic/Children’s Press, 2002. La Suerte de Ozu, México: Fondo de Cultura Económica, 2003. There Was an Old Lady Who Swallowed a Fly, Intervisual Books, 2004. Eency Weency Spider, Intervisual Books, 2005. Nacho & Lolita, de Pam Muñoz Ryan, Scholastic Press, 2005. Mientras se Enfría el Pastel, Serres, 2005. Let’s Play in the Forest / Juguemos en el Bosque, Scholastic Press, 2006 y Vaya Apetito tiene el Zorrito, Serres (próximo a salir). Tomado de La aventura de ilustrar en Colombia, en http://noticias.editorialgatomalo.com/NHL14_ilustrador.pdf;Claudia Rueda;Mujer;Claudia Rueda estudió artes plásticas, tomó un curso de ilustración de libros para niños en la Universidad de Berkeley y ha sido caricaturista, abogada, autora de cartillas educativas, viajera y madre de dos hijas. Ha trabajado como autora e ilustradora de libros para niños en España, México y Estados Unidos. Sus libros: Tres ciegos y un elefante, España: Imaginarium, 2002. Going to Grandma’s Farm, Scholastic/Children’s Press, 2002. La Suerte de Ozu, México: Fondo de Cultura Económica, 2003. There Was an Old Lady Who Swallowed a Fly, Intervisual Books, 2004. Eency Weency Spider, Intervisual Books, 2005. Nacho & Lolita, de Pam Muñoz Ryan, Scholastic Press, 2005. Mientras se Enfría el Pastel, Serres, 2005. Let’s Play in the Forest / Juguemos en el Bosque, Scholastic Press, 2006 y Vaya Apetito tiene el Zorrito, Serres (próximo a salir). Tomado de La aventura de ilustrar en Colombia, en http://noticias.editorialgatomalo.com/NHL14_ilustrador.pdf;Océano Travesía;Grande;;;;;
Matachita;2001;Imaginación;Disfraz, Juegos, Niña, Objetos, Fantasía;En un instante, Renata logra convertirse en el personaje que a su imaginación se le antoje: toma prestado cualquier objeto de su alrededor y ya encarna un ser con su propio mundo y fantasía. El disfraz es la clave.\nTomado de: https://www.panamericana.com.co/matachita/p;Alexis Forero Valderrama;Hombre;;Alexis Forero Valderrama;Hombre;;Panamericana Editorial;Grande;;;;;
El sombrerón;2008;Amor;Leyendas, Valencia editores, Poesía, Travesuras, Duende, Fantasía;Un duendecillo se enamora de una joven y hace mil pilatunas para conquistar su amor. La familia, espantada, envía a la joven a otro pueblo. Es una divertida historia, con un final inesperado. \nTomado de: http://www.panamericanaeditorial.com.co/375_alekos;Patricia Acosta;Mujer;;Alexis Forero Valderrama, Alekos;Hombre;Alekos se define como. . . Artifista colombianante. Un poco musicoso. Más bien habladoro. Pero en sobre todo. Pintirista andarino. Y enamoretas. También se sabe de él que nació en una casita de madera que construyeron sus padres, y compartió su vida con guatines, gallinas, loros, micos, perros y muñecos de palo. Luego estudió diseño gráfico en la Universidad Nacional de Colombia pero, a lo largo de los años, aprendió un poco de mucho: música, narración oral y escrita, ilustración, folclor, pintura china, antropología del arte, animación cinematográfica y payaso. En la universidad de la vida ha sido atrilero de banda de pueblo, titiritero y actor, deportista compulsivo, humorista gráfico, conspirador, payaso de fiesta, muralista, músico ambulante, escenógrafo, letrista de canciones, jurado, coplero, pintor de brocha gorda y de los que exponen, guionista, actor de televisión y otros menjurjes que ya borró el olvido.\nTomado de: http://www.panamericanaeditorial.com.co/375_alekos;Panamericana Editorial;Grande;;;;;
Bufeo y Pelusa;2012;Identidad;Amistad, Personalidades, Diferencias, Vínculos, Delfín, Morrocoy, Diversión, Animales, Fauna colombiana ;Tres cuentos en un precioso libro ilustrado con una entrañable tortuga morrocoy perezosa y un hiperactivo delfín rosado del Amazonas.\nLos tres cuentos incluidos son la carta de presentación como autora de la ilustradora colombiana Ivette Salom. Ella, que ha ilustrado decenas de cuentos para niños, se inspiró en la fauna colombiana para dar cuenta de dos perfiles también muy colombianos: el eterno y perezoso carácter del interior, representado por la bella tortuga Bufeo. y el dicharachero y libertario delfín rosado del amazonas, representado por Pelusa. Cuentos para entender que en cada personalidad hay un verdadero encanto.\nTomado de: http://www.elperegrinoediciones.com/bufeo-y-pelusa/;Ivette Salom;Mujer;;Ivette Salom;Mujer;;El Peregrino Ediciones;Independiente;El Peregrino Ediciones es una editorial colombiana dedicada a la publicación de libros de ficción y no-ficción, fundada por dos escritores. Además prestamos servicios editoriales de escritura, diseño, diagramación, corrección de estilo, edición literaria e impresión. También traducimos del inglés y el francés al español.Tomado de. http://www.elperegrinoediciones.com/quienes-somos/;;;;
El oso frontino perdió el tino;2012;Medio ambiente;Naturaleza, Animales, Cuidado, Sensibilidad, Oso, Bosque, Extinción, Cacería;El Oso Frontino de nuestra historia es todo un personaje que en medio de una aventura divertida en el bosque, nos señala los peligros que muchos animales enfrentan por la destrucción, la fragmentación de su hábitat, la cacería y las leyendas que existen en torno a su especie y que están contribuyendo a su extinción.\nEl oso frontino es aparentemente un animal solitario. Sin embargo, existen reportes de grupos de hasta ocho individuos comiendo juntos durante la época de fructificación de ciertas plantas del bosque nublado. Los osos frontinos pueden estar activos a cualquier hora del día. Son excelentes trepadores y pueden pasar bastante tiempo en las ramas más altas de los árboles, o simplemente descansan en plataformas que se asemejan a nidos, construidas con ramas y hojas.\nEs el único oso de Suramérica. Se estima que hay menos de 2.000 de estos osos en estado salvaje. Este oso es un mamífero que no ataca, solo lo hace cuando se siente en peligro él o sus crías.\nTomado de: https://www.panamericana.com.co/oso-frontino-perdio-el-tino/p;Patricia Acosta;Mujer;;Luis Darío Bernal Pinilla;Hombre;;Panamericana Editorial;Grande;;;;;
Vaivén;2010;Juego;Circo, Familia, Diversión, Carnaval, Juego, Niño, Actividad, Trabajo;Con un tono festivo Vaivén narra la historia de una familia circense en la que cada miembro, desde los ancestros hasta los descendientes, cumple un oficio distinto. Esta segunda edición tiene un nuevo formato, es más colorida y seduce a los niños con su tamaño.\nTomado de: https://www.tragaluzeditores.com/libros/vaiven/;Juan Carlos Restrepo Vivas;Hombre;;Juan Carlos Restrepo Rivas;Hombre;;Tragaluz;Independiente;;;;;
