Título;Año publicación;Tema;Tags;Sinopsis;Ilustrador;Género ilustrador;Descripción ilustrador;Escritor;Género escritor;Descripción escritor;Editorial;Tipo de editorial;Descripción editorial;Ciudad;Editor;Género editor;Descripción editor
Tengo miedo;2012;Miedo;Monstruos, Miedos, Niños, Adultos, Terrores, Desconocimiento, Noche;Eusebio no puede dormir, tiene miedo de los monstruos que aparecen en las noches... Pero lo que no sabe Eusebio es que los monstruos son seres humanos. Esto se lo hará descubrir Ananías.\nEn esta nueva versión del clásico de la literatura infantil colombiana, Ivar mantiene la historia, y la enriquece con una reflexión sobre los miedos que hoy persiguen los sueños de los niños. El control de la paleta de color y la maestría del dibujo, convierten este libro en una obra maestra para todos los públicos.\nTomado de https://www.librosmrfox.com/product-page/tengo-miedo-ivar-da-coll;Ivar Da Coll;Hombre;Ivar da Coll es uno de los exponentes más importantes del libro álbum en Colombia. Su serie Chigüiro dio inicio a la producción de este formato en nuestro país. Este autor, nacido en Bogotá en 1962, es además un escritor prolífico que a lo largo de su carrera ha realizado más de 40 títulos. Ivar da Coll nació en Bogotá, Colombia, el 13 de marzo de 1962. Su padre era italiano y su madre de ascendencia sueca. Estudió en el colegio Juan Ramón Jiménez de Bogotá.\nEn 1999, fue nominado al Premio Hans Christian Andersen en la categoría de ilustración también hizo parte de la Lista de Honor de IBBY (International Board on Books for Young People).\nHa publicado también con las editoriales Carlos Valencia Editores (Colombia), Alfaguara (Colombia-México), Ediciones Anaya (España), Ediciones Ekaré (Venezuela), Houghton Mifflin Company, Mc Graw-Hill, Simon & Schuster y Lectorum (Estados Unidos). ;Ivar Da Coll;Hombre;Ivar da Coll es uno de los exponentes más importantes del libro álbum en Colombia. Su serie Chigüiro dio inicio a la producción de este formato en nuestro país. Este autor, nacido en Bogotá en 1962, es además un escritor prolífico que a lo largo de su carrera ha realizado más de 40 títulos. Ivar da Coll nació en Bogotá, Colombia, el 13 de marzo de 1962. Su padre era italiano y su madre de ascendencia sueca. Estudió en el colegio Juan Ramón Jiménez de Bogotá.\nEn 1999, fue nominado al Premio Hans Christian Andersen en la categoría de ilustración también hizo parte de la Lista de Honor de IBBY (International Board on Books for Young People).\nHa publicado también con las editoriales Carlos Valencia Editores (Colombia), Alfaguara (Colombia-México), Ediciones Anaya (España), Ediciones Ekaré (Venezuela), Houghton Mifflin Company, Mc Graw-Hill, Simon & Schuster y Lectorum (Estados Unidos). ;Babel libros;Independiente;Babel Libros empezó en 2001 en Bogotá como distribuidora y librería, con la arquitecta María Osorio encabezando el proyecto. En 2005 se amplió el proyecto con su propio sello editorial. Se han destacado por hacer libros con tiempo, dedicación y cuidado, tienen un amplio catálogo, no solo de libro álbum, también ofrecen libros para jóvenes. Babel recibió en la Feria del Libro de Boloña el premio BOP para la Mejor Editorial Infantil y Juvenil en América Latina (Centro y Sur América). \nPágina web: babellibros.com.co/;Bogotá;;;
Jacinto y María José;2008;Infancia;Niños, Pacífico colombiano, Paisaje, Afro, Sin Palabras, Amor, Amistad, Niña, Niño;Sin palabras, con una plástica realista pero a la vez poética, Jacinto y María José es una sencilla historia sobre dos niños que se gustan en la región selvática del Pácifo afrodecendiente colombiano. En sus páginas, un candor cercano a la magia emerge de las ilustraciones y evoca los óleos de Henri Rousseau. La atmósfera de encantamiento que recorre esta obra invita a una observación detallada para mayor deleite del lector.\nPremio de Ilustración A la Orilla del Viento\nTomado dehttps://www.librosmrfox.com/product-page/jacinto-y-mar%C3%ADa-jos%C3%A9-dipacho;Dipacho;Hombre;;Dipacho;Hombre;;FCE-México;Grande;;;;;
El animal más feroz;2009;Perspectivas;Animales, Perspectiva, Zoom, Humor, Gallina, Lombroz, Depredadores, Naturaleza;Un animalito le pregunta a su madre cuál es el animal más feroz. Después de investigar seriamente una lista de posibilidades descubren cuál es el animal más terrorífico que ha habitado la tierra.;Dipacho;Hombre;;Dipacho;Hombre;;Grupo Editorial Norma;Grande;;;Ángela Cuartas;;
Todos se burlan;2009;Burla;Animales, Burla, Humor, Diferencia;De los grandes, los pequeños, los altos y los bajitos. De los que son bonitos y de los que son feos. De los que son de colores y de los que no. ¡De todos se burlan!\nTomado de https://www.panamericana.com.co/todos-se-burlan/p;Dipacho;Hombre;;Dipacho;Hombre;;Grupo Editorial Norma;Grande;;;;;
Dos pajaritos;2010;Acumulación;Pájaro, Competencia, Naturaleza, Juego, Absurdo, Humor, Sin palabras, Exceso;El mundo puede estar lleno de palabras vacías o  de silencios con sentido. El que Dipacho construye en Dos pajaritos está lleno de sentido. Y es que este libro no sólo tiene un delicioso humor, sino además, es una invitación a mirar el mundo que nos rodea, que hemos construido. A través de una narración silenciosa, no hay una sola palabra, el autor nos presenta una de las más marcadas tragedias de la vida contemporánea: la acumulación sin límite. La fascinación por tener más, por llenarlo todo, aunque, las cosas pierdan sentido y destruyan el lugar donde nos encontramos, pareciera ser la historia que nos quiere presentar este libro. Pero sobre todo, es un libro divertido. Los personajes son graciosos, casi idénticos, un poco alocados, llevados por su curiosidad, por sus impulsos, los dos pajaritos entran en un delirio que termina sepultándolos y despojándolos de todo lo que han conseguido. El ritmo de las ilustraciones tiene algo que podría considerarse como sabiduría narrativa y que no es más que la capacidad para llevar al lector por un camino entretenido y que lo cuestione como ser humano. Se trata de un bello libro, cuidadosamente editado, que me parece ideal para cualquier persona y que además pueden leer niños pequeños, pues carece de texto escrito.\nFrancisco Montaña.\nTomado de http://dipacho.blogspot.com/2010/07/dos-pajaritos.html;Dipacho;Hombre;;Dipacho;Hombre;;Lumen;Grande;;;;;
Toro rojo;2016;Enojo;Ira, Toro, Soledad, Enojo, Búsqueda, Identidad, Tinta;Este libro álbum de Dipacho cuenta la historia de un toro furioso al que no le gustaba nada ni nadie. ¿Cómo logra liberarse de su enojo y encontrarse a sí mismo? ¿Tiene que desprenderse de sí mismo para alcanzar la paz? ¿Cómo pasa de ir contra todos a, quizás, concentrarse en sí mismo? Este libro, con muy pocas frases y poderosas ilustraciones, deja abiertas muchas preguntas, y es tarea de niños, medianos y grandes aventurar sus propias respuestas.\nLettering: Gio (Giovanni Parrado)\nTomado de: https://milserifas.com/project/toro-rojo/;Dipacho;Hombre;;Dipacho;Hombre;;Milserifas;Independiente;;Bogotá;Freddy Ordóñez;Hombre;
Circo de pulgas;2005;Errores;Amistad, Perro, Transformación, Cambios, ;Nos habla de las relaciones interpersonales, y en particular sobre el derecho al buen trato, el respeto mutuo, el valor de la amistad, y el crecimiento personal dado por la experiencia y el aprendizaje.\nLa historia destaca la necesidad de reconocer los errores y resarcirlos.\nPaco, el perro protagonista, nos ofrece su forma particular de enfrentar la vida, rompiendo con las relaciones destructivas y asumiendo la posibilidad de transformar las situaciones adversas en oportunidades de superación y propiciando el desarrollo de las potencialidades.\nTomado de: http://www.editorialgatomalo.com/pages/mininos/circo.html;Enrique Lara;Hombre;Enrique Lara Robayo estudió diseño gráfico y es docente universitario de ilustración de libros infantiles, técnicas de ilustración, historietas y animación. Después de ilustrar cartillas y revistas, montó su propia editorial, GatoMalo, sello bajo el cual ha publicado la mayoría de sus libros. Salvo Earthsong (Katha, India 2005), escrito por Geeta Dharmarajan e ilustrado por él y Luis Fernando García, Enrique Lara ha concebido gráficamente y escrito los textos de todas sus obras: Me gustan las vacas (2006*, que también ilustró), Circo de pulgas (2005*) y Leaves (Katha, India, 2004, publicado como Hojas en 2005*), ambos ilustrados con Luis Fernando García, y Estúpido (2005*), con imágenes de Daniel Padilla. \nTomado de La aventura de ilustrar en Colombia, en http://noticias.editorialgatomalo.com/NHL14_ilustrador.pdf;Enrique Lara;Hombre;Enrique Lara Robayo estudió diseño gráfico y es docente universitario de ilustración de libros infantiles, técnicas de ilustración, historietas y animación. Después de ilustrar cartillas y revistas, montó su propia editorial, GatoMalo, sello bajo el cual ha publicado la mayoría de sus libros. Salvo Earthsong (Katha, India 2005), escrito por Geeta Dharmarajan e ilustrado por él y Luis Fernando García, Enrique Lara ha concebido gráficamente y escrito los textos de todas sus obras: Me gustan las vacas (2006*, que también ilustró), Circo de pulgas (2005*) y Leaves (Katha, India, 2004, publicado como Hojas en 2005*), ambos ilustrados con Luis Fernando García, y Estúpido (2005*), con imágenes de Daniel Padilla. \nTomado de La aventura de ilustrar en Colombia, en http://noticias.editorialgatomalo.com/NHL14_ilustrador.pdf;Gatomalo;Independiente;;Bogotá;;;
Estúpido;2005;Relaciones;Niño, Perro, Cariño, Vínculos afectivos, Amistad;El libro nos acerca a la mirada honesta y limpia que un niño tiene sobre su perro. Presenta un personaje de gran corazón que no hace distinciones cuando expresa su cariño a los demás, aceptando, valorando, tolerando y respetando a todos por igual, sin discriminación de ninguna especie.\nTomado de: https://www.librosmrfox.com/product-page/est%C3%BApido-lara-y-padilla;Enrique Lara;Hombre;Enrique Lara Robayo estudió diseño gráfico y es docente universitario de ilustración de libros infantiles, técnicas de ilustración, historietas y animación. Después de ilustrar cartillas y revistas, montó su propia editorial, GatoMalo, sello bajo el cual ha publicado la mayoría de sus libros. Salvo Earthsong (Katha, India 2005), escrito por Geeta Dharmarajan e ilustrado por él y Luis Fernando García, Enrique Lara ha concebido gráficamente y escrito los textos de todas sus obras: Me gustan las vacas (2006*, que también ilustró), Circo de pulgas (2005*) y Leaves (Katha, India, 2004, publicado como Hojas en 2005*), ambos ilustrados con Luis Fernando García, y Estúpido (2005*), con imágenes de Daniel Padilla. \nTomado de La aventura de ilustrar en Colombia, en http://noticias.editorialgatomalo.com/NHL14_ilustrador.pdf;Enrique Lara;Hombre;Enrique Lara Robayo estudió diseño gráfico y es docente universitario de ilustración de libros infantiles, técnicas de ilustración, historietas y animación. Después de ilustrar cartillas y revistas, montó su propia editorial, GatoMalo, sello bajo el cual ha publicado la mayoría de sus libros. Salvo Earthsong (Katha, India 2005), escrito por Geeta Dharmarajan e ilustrado por él y Luis Fernando García, Enrique Lara ha concebido gráficamente y escrito los textos de todas sus obras: Me gustan las vacas (2006*, que también ilustró), Circo de pulgas (2005*) y Leaves (Katha, India, 2004, publicado como Hojas en 2005*), ambos ilustrados con Luis Fernando García, y Estúpido (2005*), con imágenes de Daniel Padilla. \nTomado de La aventura de ilustrar en Colombia, en http://noticias.editorialgatomalo.com/NHL14_ilustrador.pdf;Gatomalo;Independiente;;Bogotá;;;
Hojas;2005;Observación;Naturaleza, Animales, Insectos, Tiempo, Cambios;Hojas es un viaje introspectivo de observación. Color y texturas ayudan a maravillarse y sensibilizarse con la belleza de la naturaleza y de sus pequeños seres. Se establecen vínculos entre los protagonistas y el transcurrir del tiempo –el ciclo de la vida y la muerte– en el universo del que formamos parte.\nEncouragement Prize 12th Noma Concours 2000 | Recomendado A Leer Ibby México, 2009\nTomado de: http://www.editorialgatomalo.com/v3/GatoMalo___Libros___Hojas.html;Enrique Lara;Hombre;Enrique Lara Robayo estudió diseño gráfico y es docente universitario de ilustración de libros infantiles, técnicas de ilustración, historietas y animación. Después de ilustrar cartillas y revistas, montó su propia editorial, GatoMalo, sello bajo el cual ha publicado la mayoría de sus libros. Salvo Earthsong (Katha, India 2005), escrito por Geeta Dharmarajan e ilustrado por él y Luis Fernando García, Enrique Lara ha concebido gráficamente y escrito los textos de todas sus obras: Me gustan las vacas (2006*, que también ilustró), Circo de pulgas (2005*) y Leaves (Katha, India, 2004, publicado como Hojas en 2005*), ambos ilustrados con Luis Fernando García, y Estúpido (2005*), con imágenes de Daniel Padilla. \nTomado de La aventura de ilustrar en Colombia, en http://noticias.editorialgatomalo.com/NHL14_ilustrador.pdf;Enrique Lara;Hombre;Enrique Lara Robayo estudió diseño gráfico y es docente universitario de ilustración de libros infantiles, técnicas de ilustración, historietas y animación. Después de ilustrar cartillas y revistas, montó su propia editorial, GatoMalo, sello bajo el cual ha publicado la mayoría de sus libros. Salvo Earthsong (Katha, India 2005), escrito por Geeta Dharmarajan e ilustrado por él y Luis Fernando García, Enrique Lara ha concebido gráficamente y escrito los textos de todas sus obras: Me gustan las vacas (2006*, que también ilustró), Circo de pulgas (2005*) y Leaves (Katha, India, 2004, publicado como Hojas en 2005*), ambos ilustrados con Luis Fernando García, y Estúpido (2005*), con imágenes de Daniel Padilla. \nTomado de La aventura de ilustrar en Colombia, en http://noticias.editorialgatomalo.com/NHL14_ilustrador.pdf;Gatomalo;Independiente;;;;;
Me gustan las vacas;2006;Imaginación;Vaca, Niña, Juego, Mascota, Imaginación, Diversión, Perspectivas;Una metáfora de liberación que acude al vuelo de la fantasía, representada mediante el juego visual de diferentes puntos de vista, combinaciones y vívidas representaciones de una imaginación que se convierte en la realidad anhelada por el razonamiento de un niño.\nIBBY’s Honor List 2008\nTomado de  http://www.editorialgatomalo.com/v3/GatoMalo___Libros___Me_gustan_las_vacas.html;Enrique Lara;Hombre;Enrique Lara Robayo estudió diseño gráfico y es docente universitario de ilustración de libros infantiles, técnicas de ilustración, historietas y animación. Después de ilustrar cartillas y revistas, montó su propia editorial, GatoMalo, sello bajo el cual ha publicado la mayoría de sus libros. Salvo Earthsong (Katha, India 2005), escrito por Geeta Dharmarajan e ilustrado por él y Luis Fernando García, Enrique Lara ha concebido gráficamente y escrito los textos de todas sus obras: Me gustan las vacas (2006*, que también ilustró), Circo de pulgas (2005*) y Leaves (Katha, India, 2004, publicado como Hojas en 2005*), ambos ilustrados con Luis Fernando García, y Estúpido (2005*), con imágenes de Daniel Padilla. \nTomado de La aventura de ilustrar en Colombia, en http://noticias.editorialgatomalo.com/NHL14_ilustrador.pdf;Enrique Lara;Hombre;Enrique Lara Robayo estudió diseño gráfico y es docente universitario de ilustración de libros infantiles, técnicas de ilustración, historietas y animación. Después de ilustrar cartillas y revistas, montó su propia editorial, GatoMalo, sello bajo el cual ha publicado la mayoría de sus libros. Salvo Earthsong (Katha, India 2005), escrito por Geeta Dharmarajan e ilustrado por él y Luis Fernando García, Enrique Lara ha concebido gráficamente y escrito los textos de todas sus obras: Me gustan las vacas (2006*, que también ilustró), Circo de pulgas (2005*) y Leaves (Katha, India, 2004, publicado como Hojas en 2005*), ambos ilustrados con Luis Fernando García, y Estúpido (2005*), con imágenes de Daniel Padilla. \nTomado de La aventura de ilustrar en Colombia, en http://noticias.editorialgatomalo.com/NHL14_ilustrador.pdf;Gatomalo;Independiente;;;;;
Bzzzzzzz...!;2007;Vuelo;Mosca, Juego, Vuelo, Sin palabras, Vaca, Observación, Imaginación ;Mediante imágenes de cálidas texturas donde las palabras sobran, Bzzzzzzz...! explora libremente la narración gráfica. Es más que el simple vuelo de tres moscas (Lola, Pepa y Arturo). se trata de un libro lleno de auto–referencias y ricos detalles que se van encontrando durante el vuelo a la cola de Florinda Margarita, la vaca de “Me gustan las vacas” \nTomado de: https://www.librosmrfox.com/product-page/bzzzzzzz-enrique-lara;Enrique Lara;Hombre;Enrique Lara Robayo estudió diseño gráfico y es docente universitario de ilustración de libros infantiles, técnicas de ilustración, historietas y animación. Después de ilustrar cartillas y revistas, montó su propia editorial, GatoMalo, sello bajo el cual ha publicado la mayoría de sus libros. Salvo Earthsong (Katha, India 2005), escrito por Geeta Dharmarajan e ilustrado por él y Luis Fernando García, Enrique Lara ha concebido gráficamente y escrito los textos de todas sus obras: Me gustan las vacas (2006*, que también ilustró), Circo de pulgas (2005*) y Leaves (Katha, India, 2004, publicado como Hojas en 2005*), ambos ilustrados con Luis Fernando García, y Estúpido (2005*), con imágenes de Daniel Padilla. \nTomado de La aventura de ilustrar en Colombia, en http://noticias.editorialgatomalo.com/NHL14_ilustrador.pdf;Enrique Lara;Hombre;Enrique Lara Robayo estudió diseño gráfico y es docente universitario de ilustración de libros infantiles, técnicas de ilustración, historietas y animación. Después de ilustrar cartillas y revistas, montó su propia editorial, GatoMalo, sello bajo el cual ha publicado la mayoría de sus libros. Salvo Earthsong (Katha, India 2005), escrito por Geeta Dharmarajan e ilustrado por él y Luis Fernando García, Enrique Lara ha concebido gráficamente y escrito los textos de todas sus obras: Me gustan las vacas (2006*, que también ilustró), Circo de pulgas (2005*) y Leaves (Katha, India, 2004, publicado como Hojas en 2005*), ambos ilustrados con Luis Fernando García, y Estúpido (2005*), con imágenes de Daniel Padilla. \nTomado de La aventura de ilustrar en Colombia, en http://noticias.editorialgatomalo.com/NHL14_ilustrador.pdf;Gatomalo;Independiente;;;;;
Mi casa;2008;Hogar;Casa, Espacio, Familia, Dos colores, Tranquilidad, Alegría, Seguridad;Hogar es algo más que cuatro paredes, es el espacio interno donde uno se siente seguro. donde se comparte con los seres amados y se es feliz. Es el lugar para compartir recuerdos y empezar a construir sueños.\nRecomendado por el Banco del Libro, 2011\nTomado de:  https://www.librosmrfox.com/product-page/mi-casa-enrique-lara;Enrique Lara;Hombre;Enrique Lara Robayo estudió diseño gráfico y es docente universitario de ilustración de libros infantiles, técnicas de ilustración, historietas y animación. Después de ilustrar cartillas y revistas, montó su propia editorial, GatoMalo, sello bajo el cual ha publicado la mayoría de sus libros. Salvo Earthsong (Katha, India 2005), escrito por Geeta Dharmarajan e ilustrado por él y Luis Fernando García, Enrique Lara ha concebido gráficamente y escrito los textos de todas sus obras: Me gustan las vacas (2006*, que también ilustró), Circo de pulgas (2005*) y Leaves (Katha, India, 2004, publicado como Hojas en 2005*), ambos ilustrados con Luis Fernando García, y Estúpido (2005*), con imágenes de Daniel Padilla. \nTomado de La aventura de ilustrar en Colombia, en http://noticias.editorialgatomalo.com/NHL14_ilustrador.pdf;Enrique Lara;Hombre;Enrique Lara Robayo estudió diseño gráfico y es docente universitario de ilustración de libros infantiles, técnicas de ilustración, historietas y animación. Después de ilustrar cartillas y revistas, montó su propia editorial, GatoMalo, sello bajo el cual ha publicado la mayoría de sus libros. Salvo Earthsong (Katha, India 2005), escrito por Geeta Dharmarajan e ilustrado por él y Luis Fernando García, Enrique Lara ha concebido gráficamente y escrito los textos de todas sus obras: Me gustan las vacas (2006*, que también ilustró), Circo de pulgas (2005*) y Leaves (Katha, India, 2004, publicado como Hojas en 2005*), ambos ilustrados con Luis Fernando García, y Estúpido (2005*), con imágenes de Daniel Padilla. \nTomado de La aventura de ilustrar en Colombia, en http://noticias.editorialgatomalo.com/NHL14_ilustrador.pdf;Gatomalo;Independiente;;;;;
Emma y Juan;2015;Diferencias;Amistad, Contrastes, Amigos, Conflicto, Diferencias, Vínculos, Oso, Tigresa, Opuestos;Emma y Juan es un libro que nos abre el camino a las respuestas posibles a esta pregunta. Toda diferencia, al principio, parece fascinante, pero con el tiempo aparecen los roces, los choques de trenes ¿Hemos de quedarnos allí?\nEn este libro, el color y las personalidades de Emma, una tigresa colorida, y Juan, un oso elegante en blanco y negro, nos permitirán aceptar que el mundo del otro es una riqueza para el mío si le doy un pequeño espacio. Las ilustraciones que nos abordan de un modo sorprendente y la intensidad de los diálogos tal vez así nos lo permitan.\nhttps://alebrijelij.wordpress.com/2017/01/10/emma-y-juan/;Amalia Satizabal;Mujer;;Amalia Satizabal;Mujer;Aunque esta bogotana estudio artes, es una total apasionada por la ilustración infantil y a eso ha dedicado gran parte de su vida. En 2011, Amalia hizo parte de la Bienal de Ilustración de Bratislava, una exposición internacional de ilustraciones de libros para niños y jóvenes, organizada por el Ministerio de Cultura de Eslovaquia y la Casa Internacional del Arte para Niños. ‘Emma y Juan’ es una de sus obras más reconocidas en donde los polos opuestos protagonizados un oso en blanco y negro y una tigresa a todo color, se atraen irremediablemente.|∞ Tomado de https://canaltrece.com.co/noticias/escritores-infantiles-colombianos/;Gatomalo;Independiente;;;;;
El lápiz;2011;Creatividad;Formas, Juego, Lápiz,;Una niña encuentra el extremo de una línea que, al avanzar las páginas, se transforma en tobogán, liana, aro, burbuja o tendedero para colgar los juguetes. Esa línea es el trazo que alguien hizo con una cera o un lápiz. pero es también guía y objeto de diversión, invención y creatividad. Un homenaje al juego, al dibujo y sus posibilidades infinitas, donde cada página guarda una sorpresa para el lector.\nTomado de: https://www.librosmrfox.com/product-page/el-l%C3%A1piz-paula-bossio\nMás información en: https://colectivobicicleta.com/entrevista-paula-bossio/;Paula Bossio;Mujer;;Paula Bossio;Mujer;;Fondo de Cultura Económica;Grande;;;;;
Había una vez, tal vez;2014;Despedidas;Amistad, Amor, León, Niña, Silencio, Despedidas, Emociones, Vínculos, Relaciones;Nuestras vidas son caminos llenos de huellas entrelazadas a través del tiempo. La alegría nos envuelve al sentirnos acompañados, mientras que la tristeza hace de las suyas en momentos de ausencia. La perfección de la existencia radica en la incertidumbre, mientras recorremos el tiempo hasta llegar al entendimiento y reconciliación con nosotros mismos.\nTomado de: http://www.editorialgatomalo.com/v3/GatoMalo___Libros___Habia_una_vez,_tal_vez.html \nPAra más información. http://revistaelparcero.com/habia-una-vez-tal-vez-educacion-sentimental-empacada-en-libro-album/;Paula Bossio;Mujer;;Paula Bossio;Mujer;;Gatomalo;Independiente;;;;;
Los direfentes;2012;Diversidad;Peronas, Diferencias, Variedad, Comparación, Observación, Cotidianidad;Es desconcertante cuando te das cuenta de que algo es extraño en cada uno de los que te rodean. en la calle, en la escuela y en el parque... a menudo te preguntas por qué son tan raras las personas, aunque esas sensaciones se desvanecen cuando llegas a casa y te sientes bien. cómodo y normal entre los tuyos.\nMención Honorífica Libro Ilustrado, Ministerio de Cultura, Colombia 2011, Libro Altamente Recomendado Fundalectura, 2013 .\nTomado de http://www.editorialgatomalo.com/v3/GatoMalo___Libros___Los_direfentes_2.html;Paula Bossio;Mujer;;Paula Bossio;Mujer;;Gatomalo;Independiente;;;;;
Mis vocales;2012;Vocales;Animales, Prelectores, Vocales, Aprendizaje, Juego,;Con versos cortos que incitan al juego, los pequeños lectores conocerán las vocales en su escritura mayúscula y minúscula. Ilustraciones divertidas con los animales de nuestra fauna como protagonistas.\nTomado de: https://www.loqueleo.com/co/libro/mis-vocales;Olga Cuéllar Serrano;Mujer;;Olga Cuéllar Serrano;Mujer;;Alfaguara infanil y juvenil;Grande;;;;;
Mis colores;2012;Colores;Animales, Insectos, Colores, América, Juego, Aprendizaje, Prelectores;Con un juego de preguntas y respuestas los niños aprenderán a reconocer los colores de algunos animales que habitan en América.\nTomado de: https://www.loqueleo.com/co/libro/mis-colores;Olga Cuéllar Serrano;Mujer;;Olga Cuéllar Serrano;Mujer;;Alfaguara infanil y juvenil;Grande;;;;;
Mis opuestos;2012;Opuestos;Animales, Opuestos, Emociones, Palabras, Prelectores, Diferencias, Comparación, Prelectores;Uno de los cinco libros para que descubran el alfabeto, las vocales, los opuestos, los colores y los números, a la vez que aprenden palabras nuevas y conocen algunos animales en peligro de extinción. Una colección entrañable para la primera infancia.\n Tomado de: https://www.loqueleo.com/co/libro/mis-opuestos;Olga Cuéllar Serrano;Mujer;;Olga Cuéllar Serrano;Mujer;;Alfaguara infanil y juvenil;Grande;;;;;
